MEC_CO_ENTIDADE,MEC_CO_UF,MEC_CO_MUNICIPIO,MEC_NO_ENTIDADE,MEC_NU_ANO_CENSO,MEC_TP_SITUACAO_FUNCIONAMENTO,MEC_TP_DEPENDENCIA,MEC_TP_LOCALIZACAO,MEC_TP_LOCALIZACAO_DIFERENCIADA,MEC_TP_CATEGORIA_ESCOLA_PRIVADA,MEC_DT_ANO_LETIVO_INICIO,MEC_DT_ANO_LETIVO_TERMINO,MEC_IN_REGULAR,MEC_IN_EJA,MEC_IN_PROFISSIONALIZANTE,MEC_IN_ESPECIAL_EXCLUSIVA,MEC_IN_COMUM_CRECHE,MEC_IN_COMUM_PRE,MEC_IN_COMUM_FUND_AI,MEC_IN_COMUM_FUND_AF,MEC_IN_COMUM_MEDIO_MEDIO,MEC_IN_COMUM_MEDIO_INTEGRADO,MEC_IN_COMUM_MEDIO_NORMAL
52013839,52,5213509,ESCOLA MUNICIPAL ARACA,2018,4,3,2,,,,,,,,,,,,,,,
52013995,52,5214903,ESC MUL PE BENICIO THOMAZ DE BASTOS,2018,4,3,2,,,,,,,,,,,,,,,
52014029,52,5214903,ESC MUL PROF JOSE CALIXTO DE ALVARENGA,2018,4,3,2,,,,,,,,,,,,,,,
52014037,52,5214903,ESC MUL PROFA MARIA MADALENA BARBOSA,2018,4,3,2,,,,,,,,,,,,,,,
52014444,52,5221080,ESC MUL JANUARIO HONORATO ALVES,2018,4,3,2,,,,,,,,,,,,,,,
52032752,52,5204557,ESC MUL DOM BOSCO,2018,4,3,2,,,,,,,,,,,,,,,
52050572,52,5217302,ESC MUL STA BARBARA,2018,4,3,2,,,,,,,,,,,,,,,
52034003,52,5208707,COLEGIO MERITO - UNIDADE I,2018,4,4,1,,,,,,,,,,,,,,,
52034160,52,5208707,COLEGIO ESTADUAL MINISTRO NASSER,2018,4,2,1,,,,,,,,,,,,,,,
52034178,52,5208707,COL EST PROF VENERANDO DE FREITAS BORGES,2018,4,2,1,,,,,,,,,,,,,,,
52034194,52,5208707,COL EST PROFA NALY DEUSDARA,2018,4,2,1,,,,,,,,,,,,,,,
52034615,52,5208707,COLEGIO BATISTA GOIANO,2018,4,4,1,,,,,,,,,,,,,,,
52034828,52,5208707,ESC EST ANICE DAHER RASSI,2018,4,2,1,,,,,,,,,,,,,,,
52034852,52,5208707,COLEGIO ESTADUAL BERNARDO SAYAO,2018,4,2,1,,,,,,,,,,,,,,,
52034976,52,5208707,ESC EST DR PEDRO LUDOVICO TEIXEIRA,2018,4,2,1,,,,,,,,,,,,,,,
52035000,52,5208707,ESCOLA ESTADUAL DUCA VIGGIANO,2018,4,2,1,,,,,,,,,,,,,,,
52035085,52,5208707,COL EST JARDIM DA LUZ,2018,4,2,1,,,,,,,,,,,,,,,
52035174,52,5208707,ESCOLA ESTADUAL JOAQUIM CAMARA FILHO,2018,4,2,1,,,,,,,,,,,,,,,
52035417,52,5208707,ESCOLA ESTADUAL PRESIDENTE KENNEDY,2018,4,2,1,,,,,,,,,,,,,,,
52035522,52,5208707,COL EST RUI BRASIL,2018,4,2,1,,,,,,,,,,,,,,,
52035557,52,5208707,COL EST SENADOR MORAIS FILHO,2018,4,2,1,,,,,,,,,,,,,,,
52035751,52,5208707,ESCOLA INFANTIL MEIMEI,2018,4,2,1,,,,,,,,,,,,,,,
52036090,52,5208707,EDUCANDARIO ESPIRITA PAULO DE TARSO,2018,4,4,1,,,,,,,,,,,,,,,
52036944,52,5208707,ESCOLA DE 1º GRAU ENG FLAVIO A CASCAO,2018,4,4,1,,,,,,,,,,,,,,,
52079643,52,5218904,COLEGIO SISTEMA,2018,4,4,1,,,,,,,,,,,,,,,
52089088,52,5200605,ESCOLA DOS SAGRADOS CORACOES,2018,1,4,1,0,1,22/01/2018,21/12/2018,1,0,0,0,1,1,1,1,0,0,0
52089096,52,5208004,ESCOLA MUNICIPAL ADELINA RODRIGUES DE SOUZA,2018,1,3,1,0,,22/01/2018,21/12/2018,1,0,0,0,0,1,1,0,0,0,0
52089118,52,5200308,ESCOLA MUNICIPAL SEBASTIANA MARIA DE JESUS,2018,1,3,1,0,,22/01/2018,20/12/2018,1,0,0,0,0,0,0,1,0,0,0
52089134,52,5213053,ESCOLA MUNICIPAL RIO MARANHAO,2018,1,3,2,3,,22/01/2018,21/12/2018,1,0,0,0,0,1,1,0,0,0,0
52089142,52,5201108,ESCOLA INFANTIL MUNDO MAGICO,2018,1,4,1,0,1,22/01/2018,11/12/2018,1,0,0,0,1,1,1,0,0,0,0
52089150,52,5205513,ESC MUL MARIA DO CARMO GUIRRA,2018,1,3,1,0,,22/01/2018,19/12/2018,1,0,0,0,0,1,1,0,0,0,0
52089169,52,5201108,SERVICO NACIONAL DE APRENDIZAGEM COMERCIAL,2018,1,4,1,0,1,01/01/2018,31/12/2018,0,0,1,0,0,0,0,0,0,0,0
52089185,52,5221403,ESCOLA RODRIGO HENRIQUE,2018,1,4,1,0,1,18/01/2018,22/12/2018,1,0,0,0,0,1,1,0,0,0,0
52089193,52,5208707,EXPOVEST JUNIOR EDUCACAO PRE-ESCOLAR LTDA,2018,1,4,1,0,1,23/01/2018,14/12/2018,1,0,0,0,1,1,1,0,0,0,0
52089207,52,5201108,COLEGIO ESTADUAL VINICIUS DE MORAES,2018,1,2,1,0,,22/01/2018,21/12/2018,1,1,0,0,0,0,0,0,1,0,0
52089215,52,5201108,CENTRO DE EDUCACAO INFANTIL PIONEIRA,2018,1,3,1,0,,10/01/2018,21/12/2018,1,0,0,0,1,1,0,0,0,0,0
52089231,52,5218300,CENTRO MUNICIPAL DE EDUCACAO INFANTIL PRIMEIROS PASSOS,2018,1,3,1,0,,22/01/2018,21/12/2018,1,0,0,0,0,1,0,0,0,0,0
52089240,52,5219803,CRECHE MUNICIPAL INFANCIA FELIZ,2018,1,3,1,0,,22/01/2018,21/12/2018,1,0,0,0,1,1,0,0,0,0,0
52089304,52,5208707,CMEI VILA REDENCAO - NAC,2018,1,3,1,0,,22/01/2018,21/12/2018,1,0,0,0,1,1,0,0,0,0,0
52077519,52,5201108,ESCOLA INFANTIL MARANATA,2018,2,4,1,,,,,,,,,,,,,,,
52090973,52,5200258,INSTITUICAO O FUTURO DO AMANHA,2018,2,4,1,,,,,,,,,,,,,,,
52069214,52,5213509,ESCOLA MUNICIPAL CIRIACA ATAIDES,2018,3,3,2,,,,,,,,,,,,,,,
52099580,52,5210208,COLEGIO DA FAI - COFAI,2018,1,4,1,0,1,19/01/2018,22/12/2018,0,0,1,0,0,0,0,0,0,0,0
52099598,52,5217302,COMPLEXO MUNICIPAL DE EDUCACAO INFANTIL DE PIRENOPOLIS,2018,1,3,1,0,,01/02/2018,21/12/2018,1,0,0,0,1,1,0,0,0,0,0
52099601,52,5212501,ESCOLA PINTANDO O SETE,2018,1,4,1,0,1,22/01/2018,20/12/2018,1,0,0,0,1,1,1,1,0,0,0
52099610,52,5221858,ESCOLA MUNICIPAL CAROLINA MARIA DE JESUS,2018,1,3,1,0,,05/02/2018,21/12/2018,1,0,0,1,0,0,1,0,0,0,0
52099628,52,5211909,CENTRO MUNICIPAL DE EDUCACAO INFANTIL EUDES ASSIS CARVALHO,2018,1,3,1,0,,01/01/2018,31/12/2018,1,0,0,0,1,1,0,0,0,0,0
52099636,52,5205109,CENTRO MUNICIPAL DE EDUCACAO INFANTIL IRMA YOLANDA VAZ,2018,1,3,1,0,,15/01/2018,21/12/2018,1,0,0,0,1,1,0,0,0,0,0
52099644,52,5213806,ESCOLA MUNICIPAL DE EDUCACAO INFANTIL PE GISLEY AZEVEDO GOMES,2018,1,3,1,0,,22/01/2018,21/12/2018,1,0,0,0,1,1,0,0,0,0,0
52099652,52,5213806,ESCOLA MUNICIPAL KLEYTON DE SOUSA PERES,2018,1,3,1,0,,22/01/2018,21/12/2018,1,0,0,0,0,1,1,0,0,0,0
52099660,52,5200258,ASSOCIACAO E CRECHE PRIMEIRO IMPERIO,2018,1,4,1,0,4,03/01/2018,21/12/2018,1,0,0,0,1,1,0,0,0,0,0
52099679,52,5201405,CENTRO MUNICIPAL DE EDUCACAO INFANTIL LEOTERIO DIAS MACHADO,2018,1,3,1,3,,18/01/2018,21/12/2018,1,0,0,0,1,1,0,0,0,0,0
52099687,52,5213806,COLEGIO NOROESTE II,2018,1,4,1,0,1,22/01/2018,21/12/2018,0,0,1,0,0,0,0,0,0,0,0
52099695,52,5217302,ESCOLA MUNICIPAL PROFESSORA IVANI RODRIGUES DA SILVA,2018,1,3,2,0,,01/02/2018,21/12/2018,1,0,0,0,0,1,1,0,0,0,0
52099709,52,5217302,ESCOLA MUNICIPAL JOSE CANDIDO BRAGA,2018,1,3,2,0,,01/02/2018,21/12/2018,1,1,0,0,0,1,1,0,0,0,0
52099725,52,5219704,CENTRO MUNICIPAL DE EDUCACAO INFANTIL BENEDITO FERREIRA CABRAL,2018,1,3,1,0,,17/01/2018,21/12/2018,1,0,0,0,1,1,0,0,0,0,0
52091996,52,5221403,CENTRO SOCIAL REDENTORISTA,2018,2,4,1,,,,,,,,,,,,,,,
52072240,52,5218003,ESCOLA MUNICIPAL ISOLADA SOPHIA JOANNA JUNKER CORADI,2018,3,3,2,,,,,,,,,,,,,,,
52086992,52,5208707,ESCOLA MONTESSORI,2018,3,4,1,,,,,,,,,,,,,,,
52100197,52,5213087,CENTRO MUNICIPAL DE EDUCACAO INFANTIL PROFESSORA REGIANE FERNANDES BATISTA,2018,1,3,1,0,,29/01/2018,22/12/2018,1,0,0,0,1,0,0,0,0,0,0
52100219,52,5209937,CENTRO MUNICIPAL DE EDUCACAO INFANTIL LUSIA MARIA NUNES AMUY,2018,1,3,1,0,,04/01/2018,21/12/2018,1,0,0,0,1,0,0,0,0,0,0
52100227,52,5208707,ESCOLA SOL DOURADO,2018,1,4,1,0,1,22/01/2018,21/12/2018,1,0,0,0,0,0,1,0,0,0,0
52100235,52,5204508,ESCOLA CENTRO EDUCACIONAL FUTURA - EDUCACAO INFANTIL,2018,1,4,1,0,1,15/01/2018,14/12/2018,1,0,0,0,1,1,0,0,0,0,0
52100243,52,5208707,COLEGIO MEDICINA,2018,1,4,1,0,1,23/01/2018,20/12/2018,1,0,0,0,0,0,0,0,1,0,0
52100251,52,5208707,ESCOLA ESTRELAS DO FUTURO,2018,1,4,1,0,1,22/01/2018,21/12/2018,1,0,0,0,1,1,1,0,0,0,0
52100260,52,5208707,CENTRO MUNICIPAL DE EDUCACAO INFANTIL MAE TINA,2018,1,3,1,0,,17/01/2018,21/12/2018,1,0,0,0,1,1,0,0,0,0,0
52100278,52,5208707,CENTRO MUNICIPAL DE EDUCACAO INFANTIL ORIENTE VILLE,2018,1,3,1,0,,22/01/2018,21/12/2018,1,0,0,0,1,1,0,0,0,0,0
52100286,52,5208707,CENTRO MUNICIPAL DE EDUCACAO INFANTIL MORADA DO SOL,2018,1,3,1,0,,22/01/2018,21/12/2018,1,0,0,0,1,1,0,0,0,0,0
52100294,52,5208707,CENTRO MUNICIPAL DE EDUCACAO INFANTIL PARQUE TREMENDAO,2018,1,3,1,0,,22/01/2018,21/12/2018,1,0,0,0,1,1,0,0,0,0,0
52100308,52,5208707,CENTRO MUNICIPAL DE EDUCACAO INFANTIL VILLAGE ATALAIA,2018,1,3,1,0,,22/01/2018,21/12/2018,1,0,0,0,1,1,0,0,0,0,0
52100316,52,5208707,CMEI MARIA FRANCISCA DA SILVA,2018,1,3,1,0,,22/01/2018,23/12/2018,1,0,0,0,1,1,0,0,0,0,0
52100324,52,5208707,CENTRO MUNICIPAL DE EDUCACAO INFANTIL RAIMUNDO LISBOA PEREIRA,2018,1,3,1,0,,22/01/2018,21/12/2018,1,0,0,0,1,1,0,0,0,0,0
52100332,52,5208707,CENTRO MUNICIPAL DE EDUCACAO INFANTIL SOLANGE PARK,2018,1,3,1,0,,22/01/2018,21/12/2018,1,0,0,0,1,1,0,0,0,0,0
52084892,52,5203807,ESCOLA SEMENTE DO SABER,2018,2,4,1,,,,,,,,,,,,,,,
52087654,52,5221403,ESC DE 1 GRAU SEMENTE PRECIOSA,2018,2,4,1,,,,,,,,,,,,,,,
52100871,52,5204904,IF GOIANO - CAMPUS CAMPOS BELOS,2018,1,1,1,0,,29/01/2018,14/12/2018,1,0,1,0,0,0,0,0,0,1,0
52100880,52,5205109,IF GOIANO - CAMPUS AVANCADO CATALAO,2018,1,1,1,0,,15/02/2018,21/12/2018,1,0,1,0,0,0,0,0,0,1,0
52100898,52,5206206,IF GOIANO - CAMPUS AVANCADO CRISTALINA,2018,1,1,1,0,,30/05/2018,30/05/2019,1,0,1,0,0,0,0,0,0,1,0
52100901,52,5209705,IF GOIANO - CAMPUS AVANCADO HIDROLANDIA,2018,1,1,2,0,,31/01/2018,20/12/2018,1,0,1,0,0,0,0,0,0,1,0
52100910,52,5210109,IF GOIANO - CAMPUS AVANCADO IPAMERI,2018,1,1,1,0,,05/02/2018,21/12/2018,1,0,1,0,0,0,0,0,0,1,0
52100928,52,5218300,IF GOIANO - CAMPUS POSSE,2018,1,1,1,0,,24/02/2018,14/12/2018,1,0,1,0,0,0,0,0,0,1,0
52100936,52,5221403,IF GOIANO - CAMPUS TRINDADE,2018,1,1,1,0,,05/02/2018,10/12/2018,1,0,1,0,0,0,0,0,0,1,0
52100944,52,5219753,EMEE PROFESSORA ALAIDES XAVIER DE GODOY,2018,1,3,1,0,,22/01/2018,21/12/2018,1,1,0,1,0,0,0,0,0,0,0
52100952,52,5208707,COLEGIO PRINCIPIOS UNIDADE II,2018,1,4,1,0,3,24/01/2018,21/12/2018,1,0,0,0,1,1,1,0,0,0,0
52100960,52,5208707,ESCOLA MAGIA DO SABER,2018,1,4,1,0,1,22/01/2018,21/12/2018,1,0,0,0,0,1,1,0,0,0,0
52100979,52,5208707,ESCOLA ART 5,2018,1,4,1,0,1,22/01/2018,14/12/2018,1,0,0,0,1,1,1,0,0,0,0
52100987,52,5201108,COLEGIO SOLUCAO,2018,1,4,1,0,1,03/01/2018,21/12/2018,0,1,0,0,0,0,0,0,0,0,0
52100995,52,5208707,ALEGRIA DO SABER BERCARIO E BRINQUEDOTECA LTDA - ME,2018,1,4,1,0,1,22/01/2018,11/12/2018,1,0,0,0,1,1,1,0,0,0,0
52101002,52,5208707,ESCOLA TIA FLAVIA,2018,1,4,1,0,1,01/02/2018,15/12/2018,1,0,0,0,1,1,1,1,0,0,0
52089274,52,5208707,COLEGIO DJ,2018,3,4,1,,,,,,,,,,,,,,,
52087379,52,5220405,COLEGIO SAO JOSE OBJETIVO,2018,2,4,1,,,,,,,,,,,,,,,
52082482,52,5212501,COLEGIO ESTADUAL JARDIM ZULEIKA,2018,3,2,1,,,,,,,,,,,,,,,
52101568,52,5203302,ESCOLA MUNICIPAL PROFESSORA ROMILDA GOMES DOS SANTOS,2018,1,3,1,0,,22/01/2018,21/12/2018,1,0,0,0,0,1,1,0,0,0,0
52101576,52,5204508,CENTRO EDUCACIONAL GERACAO DE SAMUEL,2018,1,4,1,0,1,22/01/2018,14/12/2018,1,0,0,0,1,0,0,0,0,0,0
52101584,52,5204508,ESCOLA INFANTIL KIDS,2018,1,4,1,0,1,22/01/2018,14/12/2018,1,0,0,0,1,1,0,0,0,0,0
52101592,52,5204508,ESCOLA INFANTIL MUNDO DO SABER,2018,1,4,1,0,1,22/01/2018,14/12/2018,1,0,0,0,1,0,0,0,0,0,0
52101614,52,5215603,ESCOLA MUNICIPAL PROFESSORA LAURA RIBEIRO DE OLIVEIRA,2018,1,3,1,0,,22/01/2018,21/12/2018,1,0,0,0,0,0,1,1,0,0,0
52101622,52,5204508,CENTRO EDUCACIONAL E BERCARIO PINGO DE GENTE,2018,1,4,1,0,1,22/01/2018,14/12/2018,1,0,0,0,1,0,0,0,0,0,0
52101649,52,5211909,COLEGIO SAO JOSE,2018,1,4,1,0,1,16/01/2018,20/12/2018,1,0,0,0,0,1,1,0,0,0,0
52101665,52,5208707,CENTRO EDUCACIONAL ESSENCIA DE VIDA,2018,1,4,1,0,1,22/01/2018,21/12/2018,1,0,0,0,1,1,1,0,0,0,0
52101673,52,5208707,ESCOLA SEMEAR,2018,1,4,1,0,4,23/01/2018,20/12/2018,1,0,0,0,0,0,1,0,0,0,0
52101681,52,5208707,CENTRO DE ENSINO BILINGUE EIRELI-EPP,2018,1,4,1,0,1,23/01/2018,21/12/2018,1,0,0,0,0,0,1,0,0,0,0
52101690,52,5208707,ESCOLA GOIANA BILINGUE EIRELI-EPP,2018,1,4,1,0,1,23/01/2018,21/12/2018,1,0,0,0,0,0,0,1,0,0,0
52101703,52,5205406,ESCOLA E BERCARIO AQUARELA,2018,1,4,1,0,1,01/01/2018,21/12/2018,1,0,0,0,1,0,0,0,0,0,0
52101711,52,5205406,COLEGIO IMACULADA CONCEICAO,2018,1,4,1,0,4,15/01/2018,12/12/2018,1,0,0,0,0,1,1,1,1,0,0
52101720,52,5211503,CENTRO MUNICIPAL DE EDUCACAO INFANTIL PROFESSORA SUELY MARZA DE MELO,2018,1,3,1,0,,01/02/2018,21/12/2018,1,0,0,0,1,0,0,0,0,0,0
52191427,52,5201108,ESCOLA MUNICIPAL DOUTOR ANAPOLINO SILVERIO DE FARIA,2018,1,3,1,0,,24/01/2018,21/12/2018,1,0,0,0,0,1,1,0,0,0,0
52192350,52,5208608,INSTITUTO TECNOLOGICO DO ESTADO DE GOIAS GOVERNADOR OTAVIO LAGE,2018,1,2,1,0,,08/01/2018,21/12/2018,0,0,1,0,0,0,0,0,0,0,0
52192369,52,5208707,ESCOLA INOVACAO,2018,1,4,1,0,1,22/01/2018,21/12/2018,1,0,0,0,0,1,1,1,0,0,0
52192377,52,5208707,ESCOLA MANIA DE APRENDER,2018,1,4,1,0,1,22/02/2018,21/12/2018,1,0,0,0,1,1,1,1,0,0,0
52192385,52,5222203,CENTRO MUNICIPAL DE EDUCACAO INFANTIL JOSE FREDERICO FELIX DA SILVA,2018,1,3,1,0,,22/01/2018,21/12/2018,1,0,0,0,0,1,0,0,0,0,0
52194353,52,5220108,ESCOLA MUNICIPAL ESPACO ATIVO LANE GONCALVES DIAS,2018,1,3,1,0,,22/01/2018,19/12/2018,1,0,0,0,0,1,1,0,0,0,0
52194361,52,5221858,ESCOLA MUNICIPAL ADEUVALDO BARBOSA ESPINDULA,2018,1,3,1,0,,05/02/2018,21/12/2018,1,0,0,1,0,0,1,0,0,0,0
52195350,52,5201108,CENTRO MUNICIPAL DE EDUCACAO INFANTIL PROFESSORA DALVA MARIA DIAS TRINDADE,2018,1,3,1,0,,09/01/2018,21/12/2018,1,0,0,0,1,1,0,0,0,0,0
52196356,52,5200308,ESCOLA MUNICIPAL PARQUE ALVORADA IV,2018,1,3,2,0,,22/01/2018,20/12/2018,1,0,0,0,0,1,1,1,0,0,0
52197352,52,5208004,CENTRO MUNICIPAL DE EDUCACAO INFANTIL CLARINDA LOBO DE MIRANDA,2018,1,3,1,0,,22/01/2018,21/12/2018,1,0,0,0,1,1,0,0,0,0,0
52198359,52,5208905,INSTITUTO TECNOLOGICO DO ESTADO DE GOIAS GOIANDIRA AYRES DO COUTO,2018,1,2,1,0,,17/01/2018,21/12/2018,0,0,1,0,0,0,0,0,0,0,0
52078434,52,5218805,ESCOLA DE EDUC INF SEMENTES DO AMANHA,2018,2,4,1,,,,,,,,,,,,,,,
52199355,52,5222054,CENTRO MUNICIPAL DE EDUCACAO INFANTIL INTEGRAL CONSTRUINDO O FUTURO,2018,1,3,1,0,,22/01/2018,21/12/2018,1,0,0,0,0,1,0,0,0,0,0
52200370,52,5204953,ESCOLA MUNICIPAL DE EDUCACAO INFANTIL MENINO JESUS,2018,1,3,1,0,,22/01/2018,21/12/2018,1,0,0,0,1,1,0,0,0,0,0
52200388,52,5213103,ESCOLA MUNICIPAL ENCANTO INFANTIL,2018,1,3,1,0,,22/01/2018,14/12/2018,1,0,0,0,1,1,0,0,0,0,0
52079694,52,5221858,SIST INT DE ENSINO JUSCELINO KUBITSCHEK,2018,4,4,1,,,,,,,,,,,,,,,
52079716,52,5221858,ESCOLA BRINCRIANDO,2018,4,4,1,,,,,,,,,,,,,,,
52079775,52,5212501,DOIS ANOES,2018,4,4,1,,,,,,,,,,,,,,,
52079783,52,5212501,ESCOLA CIRANDA DO SABER,2018,4,4,1,,,,,,,,,,,,,,,
52080242,52,5208707,CRECHE SAGRADA FAMILIA,2018,4,4,1,,,,,,,,,,,,,,,
52080404,52,5208707,ESCOLA TEMPO DE INFANCIA LTDA,2018,4,4,1,,,,,,,,,,,,,,,
52081443,52,5201405,ESCOLA EVOLUCAO,2018,4,4,1,,,,,,,,,,,,,,,
52078175,52,5209952,CRECHE DIVINO PAI ETERNO,2018,4,3,1,,,,,,,,,,,,,,,
52078191,52,5221403,COLEGIO ALFA OMEGA,2018,4,4,1,,,,,,,,,,,,,,,
52078370,52,5207402,CRECHE MUNICIPAL ANTONIO TEODORO DA COSTA,2018,4,3,1,,,,,,,,,,,,,,,
52081591,52,5222054,ESC INFANTIL CAMINHO DE GENIO,2018,4,4,1,,,,,,,,,,,,,,,
52081699,52,5208707,CPMG UNIDADE VASCO DOS REIS,2018,4,2,1,,,,,,,,,,,,,,,
52078795,52,5217401,CRECHE MUL ANA ISABEL,2018,4,3,1,,,,,,,,,,,,,,,
52078809,52,5217401,CRECHE MUL ANA CAROLINA,2018,4,3,1,,,,,,,,,,,,,,,
52032787,52,5204557,ESC MUL MACARIO MARQUES CAETANO,2018,4,3,2,,,,,,,,,,,,,,,
52033627,52,5208707,COL EST RUI BARBOSA,2018,4,2,1,,,,,,,,,,,,,,,
52033635,52,5208707,COLEGIO ESTADUAL SAO CRISTOVAO,2018,4,2,1,,,,,,,,,,,,,,,
52033767,52,5208707,COLEGIO PRE MEDICO,2018,4,4,1,,,,,,,,,,,,,,,
52033775,52,5208707,COLEGIO AVILA UNID I,2018,4,4,1,,,,,,,,,,,,,,,
52033791,52,5208707,COLEGIO PROF PARDAL,2018,4,4,1,,,,,,,,,,,,,,,
52037134,52,5208707,ESC MUL DOMINGOS FRANCISCO POVOA,2018,4,3,1,,,,,,,,,,,,,,,
52037428,52,5208707,ESCOLA CLUBE DE LEOES GOIANIA OESTE,2018,4,4,1,,,,,,,,,,,,,,,
52037940,52,5208707,ESCOLA SAO MIGUEL,2018,4,4,1,,,,,,,,,,,,,,,
52038297,52,5208806,CRECHE SAO GERALDO,2018,4,4,1,,,,,,,,,,,,,,,
52002802,52,5208905,ESC MUL JOSE ALVES DOS SANTOS,2018,4,3,2,,,,,,,,,,,,,,,
52002810,52,5208905,ESC MUL MACHADO,2018,4,3,2,,,,,,,,,,,,,,,
52002900,52,5208905,ESC MUL TAMANDUA,2018,4,3,2,,,,,,,,,,,,,,,
52002926,52,5208905,ESC MUL BEZERRA,2018,4,3,2,,,,,,,,,,,,,,,
52002977,52,5208905,ESC MUL SAO FELIPE,2018,4,3,2,,,,,,,,,,,,,,,
52003132,52,5208905,ESC MUL ENGENHO NOVO,2018,4,3,2,,,,,,,,,,,,,,,
52003213,52,5208905,ESC MUL SAO DOMINGOS,2018,4,3,2,,,,,,,,,,,,,,,
52003230,52,5208905,COL EST SAO PEDRO,2018,4,2,1,,,,,,,,,,,,,,,
52003272,52,5208905,ESC MUL DO ARTEZANATO ESPIRITA DE GOIAS,2018,4,3,2,,,,,,,,,,,,,,,
52003299,52,5208905,ESC MUL MUMBUCA,2018,4,3,2,,,,,,,,,,,,,,,
52003310,52,5208905,ESC MUL PASTIM,2018,4,3,2,,,,,,,,,,,,,,,
52003493,52,5211008,ESC EST OLIVEIRA PEREIRA DUARTE,2018,4,2,1,,,,,,,,,,,,,,,
52003523,52,5211008,ESC MUL CARLOS CHAGAS,2018,4,3,2,,,,,,,,,,,,,,,
52003531,52,5211008,ESC MUL CHIBATA,2018,4,3,2,,,,,,,,,,,,,,,
52003540,52,5211008,ESC MUL CHICO MENDES,2018,4,3,2,,,,,,,,,,,,,,,
52003558,52,5211008,ESC MUL CRISTOVAO COLOMBO,2018,4,3,2,,,,,,,,,,,,,,,
52003566,52,5211008,ESC MUL DUQUE DE CAXIAS,2018,4,3,2,,,,,,,,,,,,,,,
52003620,52,5211008,ESC MUL JOSE NORMANDO PEDROSA,2018,4,3,2,,,,,,,,,,,,,,,
52003671,52,5211008,ESC MUL ORLANDO BELO DE OLIVEIRA,2018,4,3,2,,,,,,,,,,,,,,,
52003701,52,5211008,ESC MUL STA LUZIA,2018,4,3,2,,,,,,,,,,,,,,,
52003930,52,5212204,ESC MUL DUQUE DE CAXIAS,2018,4,3,2,,,,,,,,,,,,,,,
52004082,52,5212204,ESC MUL SETE DE SETEMBRO,2018,4,3,2,,,,,,,,,,,,,,,
52004090,52,5212204,ESC MUL SINEAS F DE OLIVEIRA,2018,4,3,2,,,,,,,,,,,,,,,
52004147,52,5212204,ESC EST CANADA,2018,4,2,2,,,,,,,,,,,,,,,
52004155,52,5212204,ESC MUNICIPALIZADA CUSTODIO CANDIDO RIBEIRO,2018,4,3,2,,,,,,,,,,,,,,,
52004244,52,5212204,ESCOLA MODELO LTDA,2018,4,4,1,,,,,,,,,,,,,,,
52188396,52,5204706,ESCOLA TOMAS DE AQUINO,2018,4,4,1,,,,,,,,,,,,,,,
52078981,52,5214408,ESCOLA NOVA GERACAO,2018,4,4,1,,,,,,,,,,,,,,,
52079120,52,5217708,ASSOCIACAO COMUNITARIA CASA DA CRIANCA DOM FERRO,2018,4,4,1,,,,,,,,,,,,,,,
52081796,52,5221700,ESC MUL JOSE RIBEIRO MAGALHAES,2018,4,3,1,,,,,,,,,,,,,,,
52081923,52,5204508,COLEGIO RIO QUENTE,2018,4,4,1,,,,,,,,,,,,,,,
52082210,52,5209101,ESCOLA PLANETA CRIANCA,2018,4,4,1,,,,,,,,,,,,,,,
52082423,52,5212501,OBRAS SOCIAIS DA UNIAO ESPIRITA LAR DE CIPRIANA,2018,4,4,1,,,,,,,,,,,,,,,
52082466,52,5212501,ESCOLA ESTADUAL MINGONE II,2018,4,2,1,,,,,,,,,,,,,,,
52082512,52,5219803,ESC MUL CACHOEIRA,2018,4,3,2,,,,,,,,,,,,,,,
52024563,52,5211404,ESCOLA MUNICIPAL CORREGO DO VEADO,2018,4,3,1,,,,,,,,,,,,,,,
52000150,52,5206404,ESC MUL CAMARGO,2018,4,3,2,,,,,,,,,,,,,,,
52000184,52,5206404,ESC MUL FREDERICO DIETZ,2018,4,3,2,,,,,,,,,,,,,,,
52000249,52,5206404,ESC MUL UNITARIA RURAL MATO VERDE,2018,4,3,2,,,,,,,,,,,,,,,
52001393,52,5220207,ESCOLA PAROQUIAL SAO MIGUEL ARCANJO,2018,4,4,1,,,,,,,,,,,,,,,
52078620,52,5219712,CRECHE MUL JOAQUIM JOSE DA SILVA,2018,4,3,1,,,,,,,,,,,,,,,
52078698,52,5201801,COL DEGRAU,2018,4,4,1,,,,,,,,,,,,,,,
52078710,52,5201108,ESCOLA EXPRESSAO,2018,4,4,1,,,,,,,,,,,,,,,
52008606,52,5214101,ESC MUL PEDRO B FERREIRA,2018,4,3,2,,,,,,,,,,,,,,,
52010333,52,5218003,ESC EST JOSE ANTONIO DE MATTOS,2018,4,2,1,,,,,,,,,,,,,,,
52010520,52,5218003,ESC MUL ANTONIO DE B GARCAO,2018,4,3,2,,,,,,,,,,,,,,,
52010660,52,5218003,ESC MUL MARIA VIEIRA SOARES,2018,4,3,2,,,,,,,,,,,,,,,
52022625,52,5209606,ESCOLA MUNICIPAL LUIZ GONZAGA DE QUEIROZ,2018,4,3,2,,,,,,,,,,,,,,,
52022749,52,5210000,COLEGIO FREI NAZARENO,2018,4,4,1,,,,,,,,,,,,,,,
52022790,52,5210000,ESCOLA RURAL MUNICIPAL JOSE ANTONIO FERREIRA,2018,4,3,2,,,,,,,,,,,,,,,
52091805,52,5211305,ESC MUL ORESTES RODRIGUES DE FREITAS,2018,1,3,1,0,,22/01/2018,21/12/2018,1,0,0,0,0,0,1,0,0,0,0
52091813,52,5213087,CENTRO DE EDUCACAO INFANTIL RAIOS DE SOL,2018,1,3,1,0,,30/01/2018,20/12/2018,1,0,0,0,0,1,0,0,0,0,0
52091830,52,5204508,COLEGIO EVANGELICO NACAO SANTA,2018,1,4,1,0,1,18/01/2018,20/12/2018,1,0,0,0,1,1,1,1,0,0,0
52091848,52,5204508,COLEGIO SANTA CLARA,2018,1,4,1,0,1,15/01/2018,21/12/2018,1,0,0,0,0,1,1,1,0,0,0
52091880,52,5218391,ESCOLA MUNICIPAL PROFESSOR GERACY PEREIRA DOS SANTOS,2018,1,3,1,3,,22/01/2018,17/12/2018,1,1,0,0,1,1,1,0,0,0,0
52091902,52,5212709,ESCOLA ESTADUAL VALTER MOREIRA DOS SANTOS,2018,1,2,1,0,,02/01/2018,31/12/2018,1,0,0,0,0,0,0,1,0,0,0
52091910,52,5207808,CRECHE MUNICIPAL CRIANCA FELIZ DE FIRMINOPOLIS,2018,1,3,1,0,,22/01/2018,18/12/2018,1,0,0,0,1,1,0,0,0,0,0
52091929,52,5203559,ESC MUL JOAO NATAL DE ALMEIDA,2018,1,3,1,0,,22/01/2018,21/12/2018,1,0,0,0,0,0,1,0,0,0,0
52091937,52,5221403,EDUCANDARIO SANTA TEREZINHA,2018,1,4,1,0,1,22/01/2018,21/12/2018,1,0,0,0,0,1,1,0,0,0,0
52091953,52,5200050,ESCOLA MARIA DE LOURDES,2018,1,4,1,0,1,22/01/2018,20/12/2018,1,0,0,0,1,1,1,0,0,0,0
52091961,52,5221403,CENTRO MUNICIPAL DE EDUCACAO INFANTIL WILMA SOARES DE PAULA,2018,1,3,1,0,,22/01/2018,21/12/2018,1,0,0,0,1,1,0,0,0,0,0
52091970,52,5221403,CENTRO MUNICIPAL DE EDUCACAO INFANTIL MODELO,2018,1,3,1,0,,22/01/2018,21/12/2018,1,0,0,0,1,1,0,0,0,0,0
52091988,52,5221403,CENTRO MUNICIPAL DE EDUCACAO INFANTIL MARIA DA CONCEICAO PEREIRA,2018,1,3,1,0,,22/01/2018,21/12/2018,1,0,0,0,0,1,0,0,0,0,0
52092003,52,5221577,ESCOLA FAMILIA AGRICOLA DE UIRAPURU,2018,1,4,2,4,2,29/01/2018,14/12/2018,1,0,1,0,0,0,0,0,0,1,0
52092631,52,5217609,ESCOLA MUNICIPAL PROFESSORA JULIA DA SILVA OLIVEIRA,2018,1,3,1,0,,22/01/2018,21/12/2018,1,0,0,0,0,1,1,1,0,0,0
52092640,52,5217609,ESCOLA MUNICIPAL OLAVO BILAC,2018,1,3,1,0,,22/01/2018,21/12/2018,1,0,0,0,0,1,1,1,0,0,0
52092658,52,5217609,ESCOLA MUNICIPAL JORGE AMADO,2018,1,3,1,0,,22/01/2018,21/12/2018,1,0,0,0,0,0,1,1,0,0,0
52092666,52,5217609,ESCOLA MUNICIPAL CORA CORALINA,2018,1,3,1,0,,22/01/2018,21/12/2018,1,0,0,0,0,1,1,0,0,0,0
52092674,52,5217609,ESCOLA MUNICIPAL CARLOS DRUMMOND DE ANDRADE,2018,1,3,1,0,,22/01/2018,21/12/2018,1,0,0,0,0,1,1,1,0,0,0
52092682,52,5202502,COLEGIO ESTADUAL INDIGENA MAUREHI,2018,1,2,2,2,,22/01/2018,21/12/2018,1,1,0,0,0,0,1,1,0,0,0
52092690,52,5220454,ESCOLA MUNICIPAL BENEDITO RODRIGUES DE MORAES,2018,1,3,1,0,,19/01/2018,19/12/2018,1,0,0,0,0,0,1,0,0,0,0
52092712,52,5200050,ESC MUL PROFESSOR NELI ANTONIO DOS SANTOS,2018,1,3,1,0,,22/01/2018,21/12/2018,1,0,0,0,0,0,1,1,0,0,0
52092763,52,5208707,ESC MUL JOAO VIEIRA DA PAIXAO,2018,1,3,1,0,,17/01/2018,21/12/2018,1,1,0,0,0,0,1,1,0,0,0
52092771,52,5208707,ESC MUL PROFA DALISIA ELIZABETH MARTINS DOLLES,2018,1,3,1,0,,22/01/2018,20/12/2018,1,0,0,0,0,1,1,1,0,0,0
52092780,52,5208707,ESC MUL PATRICIA RODRIGUES DE PAIVA,2018,1,3,1,0,,17/01/2018,21/12/2018,1,1,0,0,0,1,1,1,0,0,0
52092798,52,5219753,CENTRO MUNICIPAL DE EDUCACAO INFANTIL MAEZINHA DO CEU,2018,1,3,1,0,,22/01/2018,21/12/2018,1,0,0,0,0,1,0,0,0,0,0
52092828,52,5203906,CRECHE ESCOLA MARIA GOMES DE PAIVA,2018,1,3,1,0,,22/01/2018,21/12/2018,1,0,0,0,1,1,0,0,0,0,0
52092836,52,5201108,COLEGIO ORION VESTIBULARES,2018,1,4,1,0,1,23/01/2018,14/12/2018,1,0,0,0,1,1,1,1,1,0,0
52071430,52,5213053,ESC MUL BURITIS,2018,3,3,2,,,,,,,,,,,,,,,
52080153,52,5208707,BERCARIO FLORESCER,2018,3,4,1,,,,,,,,,,,,,,,
52102211,52,5201108,CENTRO MUNICIPAL DE EDUCACAO INFANTIL PROFESSORA CINTHYA RODRIGUES COSTA DOS SANTOS,2018,1,3,1,0,,10/01/2018,21/12/2018,1,0,0,0,1,1,0,0,0,0,0
52102220,52,5204508,ESCOLA ESTADUAL DELCIDES FERREIRA DE MORAIS,2018,1,2,1,0,,02/01/2018,28/12/2018,1,1,0,0,0,0,0,1,1,0,0
52102270,52,5201405,CENTRO MUNICIPAL DE EDUCACAO INFANTIL AZELIA DE OLIVEIRA,2018,1,3,1,0,,18/01/2018,21/12/2018,1,0,0,0,1,1,0,0,0,0,0
52102289,52,5201405,CENTRO MUNICIPAL DE EDUCACAO INFANTIL BENEDITA MARIA DO NASCIMENTO,2018,1,3,1,0,,18/01/2018,21/12/2018,1,0,0,0,1,1,0,0,0,0,0
52102297,52,5201405,CENTRO MUNICIPAL DE EDUCACAO INFANTIL BURITI SERENO,2018,1,3,1,0,,18/01/2018,21/12/2018,1,0,0,0,1,1,0,0,0,0,0
52102319,52,5201405,CENTRO MUNICIPAL DE EDUCACAO INFANTIL CANTIDIO RODRIGUES DA SILVA,2018,1,3,1,0,,18/01/2018,21/12/2018,1,0,0,0,1,1,0,0,0,0,0
52102327,52,5201405,CENTRO MUNICIPAL DE EDUCACAO INFANTIL JOESLENE MARTINS SILVA ROSA,2018,1,3,1,0,,18/01/2018,21/12/2018,1,0,0,0,1,1,0,0,0,0,0
52102335,52,5201405,CENTRO MUNICIPAL DE EDUCACAO INFANTIL JOSE VICENTE DE ARAUJO,2018,1,3,1,0,,18/01/2018,21/12/2018,1,0,0,0,1,1,0,0,0,0,0
52102343,52,5201405,CENTRO MUNICIPAL DE EDUCACAO INFANTIL PARQUE PRIMAVERA,2018,1,3,1,0,,18/01/2018,21/12/2018,1,0,0,0,1,1,0,0,0,0,0
52102351,52,5201405,CENTRO MUNICIPAL DE EDUCACAO INFANTIL RESIDENCIAL ARAGUAIA,2018,1,3,1,0,,18/01/2018,21/12/2018,1,0,0,0,1,1,0,0,0,0,0
52102360,52,5201405,COLEGIO PADRAO,2018,1,4,1,0,1,23/01/2018,17/12/2018,1,0,0,0,1,1,1,1,1,0,0
52102378,52,5201405,ESCOLA INFANTIL BRINCAR E APRENDER,2018,1,4,1,0,1,29/01/2018,21/12/2018,1,0,0,0,0,1,1,0,0,0,0
52102386,52,5221403,CENTRO MUNICIPAL DE EDUCACAO INFANTIL DAGMAR REIS BARROS,2018,1,3,1,0,,22/01/2018,21/12/2018,1,0,0,0,1,1,0,0,0,0,0
52102432,52,5209101,TIA MABIA CENTRO EDUCACIONAL EIRELI - ME,2018,1,4,1,0,1,22/01/2018,18/12/2018,1,0,0,0,1,1,1,0,0,0,0
52085988,52,5218805,COLEGIO FORMACAO,2018,2,4,1,,,,,,,,,,,,,,,
52095339,52,5200258,CENTRO EDUCACIONAL LM LTDA,2018,3,4,1,,,,,,,,,,,,,,,
52102890,52,5215603,CENTRO DE ENSINO SOSSEGO DA MAMAE,2018,1,4,1,0,1,22/01/2018,21/12/2018,1,0,0,0,1,1,1,1,0,0,0
52102904,52,5200258,CENTRO SOCIEDADE ESTACAO VIDA,2018,1,4,1,0,4,24/01/2018,20/12/2018,1,0,0,0,1,1,0,0,0,0,0
52102912,52,5208707,CENTRO DE EDUCACAO LUMINARE LTDA EPP,2018,1,4,1,0,1,23/01/2018,19/12/2018,1,0,0,0,1,1,1,1,0,0,0
52102920,52,5211909,CENTRO MUNICIPAL DE EDUCACAO INFANTIL UBALDINA RIBEIRO,2018,1,3,1,0,,01/01/2018,31/12/2018,1,0,0,0,1,1,0,0,0,0,0
52102939,52,5211503,CENTRO DE EDUCACAO INFANTIL GERA VIDA,2018,1,4,1,0,4,01/02/2018,21/12/2018,1,0,0,0,1,0,0,0,0,0,0
52102955,52,5208707,ESCOLA CENTRO OESTE,2018,1,4,1,0,1,22/01/2018,07/12/2018,1,0,0,0,1,1,1,0,0,0,0
52102963,52,5208707,CEM - CENTRO EDUCACIONAL MABEL,2018,1,4,1,0,1,17/01/2018,14/12/2018,1,0,0,0,0,0,1,0,0,0,0
52102998,52,5203500,CENTRO DE ATENDIMENTO INFANTO-JUVENIL OMARIA GARCIA DE OLIVEIRA,2018,1,3,1,0,,22/01/2018,21/12/2018,1,0,0,0,1,0,0,0,0,0,0
52103005,52,5201108,ESCOLA AUGUSTUS,2018,1,4,1,0,1,22/01/2018,19/12/2018,1,0,0,0,1,1,1,0,0,0,0
52103013,52,5201405,CRECHE ANJO DA GUARDA - OBRA DOM ORIONE,2018,1,4,1,0,4,30/01/2018,20/12/2018,1,0,0,0,1,1,0,0,0,0,0
52103021,52,5204508,COLEGIO EDUCACIONAL UNIVERSO,2018,1,4,1,0,1,04/01/2018,13/12/2018,1,0,0,0,0,1,1,0,0,0,0
52103030,52,5208301,ESCOLA MUNICIPAL VEREADOR JOSE DE TORRES QUINTANILHA,2018,1,3,2,3,,22/01/2018,21/12/2018,1,0,0,0,0,0,1,0,0,0,0
52103048,52,5205497,COLEGIO ESTADUAL JOSE ABILIO,2018,1,2,1,0,,22/01/2018,21/12/2018,1,1,0,0,0,0,0,0,1,0,0
52103056,52,5221858,COLEGIO ESTADUAL JOSE NUNES DA SILVA,2018,1,2,1,0,,22/01/2018,21/12/2018,0,1,0,0,0,0,0,0,0,0,0
52103595,52,5208707,CENTRO DE EDUCACAO INFANTIL SUELY PASCHOAL,2018,1,4,1,0,1,22/01/2018,21/12/2018,1,0,0,0,1,1,0,0,0,0,0
52103617,52,5201405,ESCOLA TIA MARLENE - CENTRO EDUCACIONAL INTELECTUS,2018,1,4,1,0,1,18/01/2018,14/12/2018,1,0,0,0,1,1,1,1,0,0,0
52103625,52,5220603,CENTRO EDUCACIONAL GIRASSOL,2018,1,4,1,0,1,22/01/2018,18/12/2018,1,0,0,0,1,1,1,0,0,0,0
