MEC_CO_ENTIDADE,MEC_CO_UF,MEC_CO_MUNICIPIO,MEC_NO_ENTIDADE,MEC_NU_ANO_CENSO,MEC_TP_SITUACAO_FUNCIONAMENTO,MEC_TP_DEPENDENCIA,MEC_TP_LOCALIZACAO,MEC_TP_LOCALIZACAO_DIFERENCIADA,MEC_TP_CATEGORIA_ESCOLA_PRIVADA,MEC_DT_ANO_LETIVO_INICIO,MEC_DT_ANO_LETIVO_TERMINO,MEC_IN_REGULAR,MEC_IN_EJA,MEC_IN_PROFISSIONALIZANTE,MEC_IN_ESPECIAL_EXCLUSIVA,MEC_IN_COMUM_CRECHE,MEC_IN_COMUM_PRE,MEC_IN_COMUM_FUND_AI,MEC_IN_COMUM_FUND_AF,MEC_IN_COMUM_MEDIO_MEDIO,MEC_IN_COMUM_MEDIO_INTEGRADO,MEC_IN_COMUM_MEDIO_NORMAL
52081672,52,5208707,COLEGIO PROJETO DIDATICO,2018,1,4,1,0,1,22/01/2018,14/12/2018,1,0,0,0,1,1,1,1,1,0,0
52081680,52,5208707,COLEGIO ROSAMARQUES,2018,1,4,1,0,1,29/01/2018,21/12/2018,1,0,0,0,1,1,1,1,1,0,0
52081710,52,5216403,CENTRO MUNICIPAL DE EDUCACAO INFANTIL DONA RONAN DA SILVA,2018,1,3,1,0,,26/01/2018,21/12/2018,1,0,0,0,1,1,0,0,0,0,0
52081788,52,5221700,ESCOLA MUNICIPAL MARIA FELIX DE OLIVEIRA,2018,1,3,1,0,,22/01/2018,21/12/2018,1,0,0,0,0,1,1,0,0,0,0
52081826,52,5205307,ESCOLA MUNICPAL MORRO ENCANTADO,2018,1,3,1,0,,22/01/2018,18/12/2018,1,0,0,0,0,1,1,0,0,0,0
52081850,52,5200258,COLEGIO ESTADUAL PIAGET,2018,1,2,1,0,,02/01/2018,31/12/2018,1,1,0,0,0,0,0,1,1,0,0
52081869,52,5200258,ESC MUNICIPAL EDNALDA GUEDES DE SOUZA,2018,1,3,1,0,,24/01/2018,20/12/2018,1,0,0,0,0,1,1,0,0,0,0
52081877,52,5200159,ESCOLA MUNICIPAL DONA GUIOMAR ALMEIDA SILVA,2018,1,3,1,0,,22/01/2018,21/12/2018,1,0,0,0,0,0,1,0,0,0,0
52081907,52,5215231,ESCOLA MUNICIPAL CECILIA MEIRELES,2018,1,3,1,0,,19/02/2018,20/12/2018,1,0,0,0,0,1,1,0,0,0,0
52081940,52,5204508,COLEGIO GOYAZ,2018,1,4,1,0,1,22/01/2018,19/12/2018,1,0,0,0,0,0,1,1,1,0,0
52081958,52,5220108,ESC MUL DOM PEDRO II,2018,1,3,1,0,,22/01/2018,21/12/2018,1,0,0,0,0,1,1,0,0,0,0
52081966,52,5220108,COLEGIO EVANGELICO NOVA VISAO,2018,1,4,1,0,1,22/01/2018,19/12/2018,1,0,0,0,1,1,1,1,1,0,0
52095932,52,5201108,ESCOLA EVANGELICA PROJETO DE VIDA,2018,2,4,1,,,,,,,,,,,,,,,
52188426,52,5217609,ESCOLA DESTAK,2018,2,4,1,,,,,,,,,,,,,,,
52043479,52,5200100,ESCOLA MUNICIPAL TRES VEREDAS,2018,2,3,2,,,,,,,,,,,,,,,
52082628,52,5221551,ESCOLA MUNICIPAL DO ENSINO FUNDAMENTAL GERALDO SIRIO,2018,1,3,1,0,,17/01/2018,14/12/2018,1,1,0,0,0,0,1,1,0,0,0
52082636,52,5218805,ESCOLA MUNICIPAL DE ENSINO FUNDAMENTAL LYBIA VIDAL SILVA,2018,1,3,1,0,,15/01/2018,18/12/2018,1,0,0,0,0,0,1,0,0,0,0
52082644,52,5208707,ESC MUL RECANTO DO BOSQUE,2018,1,3,1,0,,22/01/2018,21/12/2018,1,1,0,0,0,1,1,1,0,0,0
52082652,52,5208707,ESCOLA MUNICIPAL NOVA CONQUISTA,2018,1,3,1,0,,22/01/2018,21/12/2018,1,1,0,0,0,0,1,1,0,0,0
52082660,52,5208707,ESC MUL AYRTON SENNA,2018,1,3,1,0,,22/01/2018,21/12/2018,1,0,0,0,0,1,1,0,0,0,0
52082679,52,5208707,ESC MUL MARIA CLARA MACHADO,2018,1,3,1,0,,22/01/2018,21/12/2018,1,0,0,0,0,1,1,1,0,0,0
52082687,52,5208707,CMEI DA BOA PROVIDENCIA,2018,1,3,1,0,,22/01/2018,21/12/2018,1,0,0,0,1,1,0,0,0,0,0
52082695,52,5205471,ESC MUL EDUC INFAN E ENS FUND FLORES CER,2018,1,3,1,0,,05/02/2018,19/12/2018,1,0,0,0,0,0,1,1,0,0,0
52082709,52,5217609,ESCOLA MUNICIPAL CONQUISTA DO SABER,2018,1,3,1,0,,22/01/2018,21/12/2018,1,0,0,0,0,1,1,0,0,0,0
52082717,52,5211909,ESCOLA MUNICIPAL IRMA SCHEILLA,2018,1,3,1,0,,01/01/2018,31/12/2018,1,0,0,0,0,1,1,0,0,0,0
52082733,52,5213772,ESC MUL PULQUERIO MARIANO DA SILVA,2018,1,3,1,0,,22/01/2018,21/12/2018,1,0,0,0,0,1,1,0,0,0,0
52082741,52,5208004,ESCOLA MUNICIPAL DOMINGOS DE JESUS MONTEIRO GUIMARAES,2018,1,3,1,0,,22/01/2018,21/12/2018,1,1,0,0,0,1,1,1,0,0,0
52082750,52,5208004,ESCOLA MUNICIPAL WALDA MIRANDA DE PAIVA,2018,1,3,1,0,,22/01/2018,21/12/2018,1,0,0,0,0,1,1,1,0,0,0
52082768,52,5206503,ESCOLA MUNICIPAL DE CROMINIA,2018,1,3,1,0,,22/01/2018,21/12/2018,1,0,0,0,0,1,1,0,0,0,0
52082784,52,5206503,CRECHE MUNICIPAL DONA HELENA,2018,1,3,1,0,,22/01/2018,21/12/2018,1,0,0,0,1,0,0,0,0,0,0
52088170,52,5208707,CENTRO DE EDUCACAO INFANTIL EFICACIA,2018,1,4,1,0,4,16/01/2018,21/12/2018,1,0,0,0,1,1,0,0,0,0,0
52088189,52,5208707,CENTRO DE EDUCACAO INFANTIL RABONI,2018,1,4,1,0,4,16/01/2018,21/12/2018,1,0,0,0,1,1,0,0,0,0,0
52088197,52,5208707,CENTRO DE EDUCACAO INFANTIL PAGIEL,2018,1,4,1,0,4,16/01/2018,21/12/2018,1,0,0,0,1,1,0,0,0,0,0
52088219,52,5211701,ACAO SOC PAR DE JANDAIA CRECHE LAR SAG FAMILIA,2018,1,3,1,0,,22/01/2018,21/12/2018,1,0,0,0,1,1,0,0,0,0,0
52088227,52,5208707,CMEI PROFESSORA DARLY,2018,1,3,1,0,,17/01/2018,20/12/2018,1,0,0,0,1,1,0,0,0,0,0
52088278,52,5208707,ESCOLA MARLENE BELLIZZI,2018,1,4,1,0,1,22/01/2018,14/12/2018,1,0,0,0,0,1,1,0,0,0,0
52088308,52,5210000,COLEGIO MONSENHOR,2018,1,4,1,0,1,22/01/2018,06/12/2018,1,0,0,0,0,0,0,0,1,0,0
52088316,52,5206800,ESCOLA MUNICIPAL PROFESSORA MARIA EUGENIA PESSOA BORGES,2018,1,3,1,0,,22/01/2018,21/12/2018,1,0,0,0,1,1,1,0,0,0,0
52088324,52,5207535,ESC MUL JOSE PEREIRA BORGES,2018,1,3,2,0,,22/01/2018,21/12/2018,1,0,0,0,0,0,1,0,0,0,0
52088332,52,5207535,CRECHE MUL DONA MARIA CARDOSA,2018,1,3,1,0,,22/01/2018,21/12/2018,1,0,0,0,1,1,0,0,0,0,0
52088359,52,5214861,ESCOLA LUZES DO SABER,2018,1,4,1,0,1,22/01/2018,21/12/2018,1,0,0,0,0,1,1,0,0,0,0
52088375,52,5219001,CRECHE TIA MARIA,2018,1,3,1,0,,22/01/2018,21/12/2018,1,0,0,0,1,1,0,0,0,0,0
52088383,52,5205406,SERVICO NACIONAL DE APRENDIZAGEM COMERCIAL,2018,1,4,1,0,1,29/01/2018,20/12/2018,0,0,1,0,0,0,0,0,0,0,0
52088391,52,5209606,ESCOLA MUNICIPAL PEDRO XAVIER,2018,1,3,1,0,,22/01/2018,21/12/2018,1,0,0,0,0,1,1,0,0,0,0
52075389,52,5214838,ESCOLA INFANTIL TIA MANO,2018,3,4,1,,,,,,,,,,,,,,,
52075613,52,5203962,CRECHE MUNICIPAL IONE SOUSA NERES,2018,3,3,1,,,,,,,,,,,,,,,
52015084,52,5205000,ESC MUL WILSON BALESTRA,2018,1,3,1,0,,22/01/2018,21/12/2018,1,0,0,0,0,1,1,0,0,0,0
52015130,52,5220280,ESCOLA MUNICIPAL DOM PEDRO I,2018,1,3,1,0,,22/01/2018,21/12/2018,1,0,0,0,0,0,1,0,0,0,0
52015319,52,5220280,CENTRO MUNICIPAL DA EDUCACAO INFANTIL PROFESSOR SEBASTIAO PINTO,2018,1,3,1,0,,22/01/2018,21/12/2018,1,0,0,0,0,1,0,0,0,0,0
52015335,52,5205406,COLEGIO ALVARO DE MELO,2018,1,4,1,0,4,29/01/2018,21/12/2018,1,0,0,0,1,1,1,1,1,0,0
52015343,52,5210158,ESC MUL DAMIAO BARRETO DOS SANTOS,2018,1,3,2,0,,22/01/2018,21/12/2018,1,0,0,0,0,1,1,1,0,0,0
52015351,52,5205406,COLEGIO DA POLICIA MILITAR HELIO VELOSO,2018,1,2,1,0,,22/01/2018,21/12/2018,1,0,0,0,0,0,0,1,1,0,0
52015360,52,5205406,CENTRO DE ENSINO EM PERIODO INTEGRAL JOAO XXIII,2018,1,2,1,0,,02/01/2018,31/12/2018,1,0,0,0,0,0,0,0,1,0,0
52015378,52,5205406,CENTRO DE ENSINO EM PERIODO INTEGRAL SAO TOMAZ DE AQUINO,2018,1,2,1,0,,22/01/2018,21/12/2018,1,0,0,0,0,0,1,1,0,0,0
52015386,52,5210158,COLEGIO ESTADUAL SETE DE SETEMBRO,2018,1,2,1,0,,22/01/2018,21/12/2018,1,1,0,0,0,0,0,1,1,0,0
52015408,52,5205406,ESCOLA BERNARDO SAYAO,2018,1,4,1,0,1,22/01/2018,21/12/2018,1,0,0,0,0,0,0,1,0,0,0
52015432,52,5205406,CENTRO DE ENSINO EM PERIODO INTEGRAL PROFESSORA MARIA CARMELITA MACEDO CORREA,2018,1,2,1,0,,22/01/2018,21/12/2018,1,0,0,0,0,0,1,1,0,0,0
52015459,52,5205406,CENTRO DE ENSINO EM TEMPO INTEGRAL VIRGILIO DO VALE,2018,1,2,1,0,,02/01/2018,31/12/2018,1,0,0,0,0,0,0,1,0,0,0
52015742,52,5205406,COLEGIO SOLAR,2018,1,4,1,0,1,22/01/2018,14/12/2018,1,0,0,0,1,1,1,1,1,0,0
52015750,52,5205406,ESCOLA LOGOS LTDA,2018,1,4,1,0,1,15/01/2018,12/12/2018,1,0,0,0,1,1,1,0,0,0,0
52087522,52,5208707,CRECHE UNIVERSIDADE FEDERAL DE GOIAS,2018,2,1,1,,,,,,,,,,,,,,,
52017303,52,5210901,COLEGIO ASSUNCAO,2018,1,4,1,0,4,02/01/2018,31/12/2018,1,0,1,0,1,1,1,1,1,0,0
52017311,52,5210901,COLEGIO ESTADUAL DA POLICIA MILITAR DE GOIAS GERALDA ANDRADE MARTINS,2018,1,2,1,0,,02/01/2018,21/12/2018,1,0,0,0,0,0,0,1,1,0,0
52017320,52,5210901,ESCOLA ESTADUAL LUIZ ALVES MACHADO,2018,1,2,1,0,,02/01/2018,30/12/2018,1,1,0,0,0,0,0,1,1,0,0
52017338,52,5210901,ESCOLA ESTADUAL NOVA PONTE,2018,1,2,2,0,,02/01/2018,30/12/2018,1,1,0,0,0,0,1,1,0,0,0
52017354,52,5210901,CENTRO DE ENSINO EM PERIODO INTEGRAL SANTA TEREZINHA,2018,1,2,1,0,,02/01/2018,30/12/2018,1,0,0,0,0,0,0,1,0,0,0
52017362,52,5210901,ESCOLA ESTADUAL VICENCA MARIA DE JESUS,2018,1,2,1,0,,02/01/2018,30/12/2018,1,1,0,0,0,0,0,1,0,0,0
52017575,52,5211206,COLEGIO ESTADUAL DE ITAPURANGA,2018,1,2,1,0,,02/01/2018,31/12/2018,1,1,1,0,0,0,0,0,1,0,0
52017583,52,5211206,COLEGIO ESTADUAL DEPUTADO JOSE ALVES DE ASSIS,2018,1,2,1,0,,02/01/2018,30/12/2018,1,0,0,0,0,0,0,1,1,0,0
52017613,52,5211206,ESCOLA ESTADUAL JOAQUIM ANTONIO DE OLIVEIRA,2018,1,2,1,0,,02/01/2018,31/12/2018,1,0,0,0,0,0,1,1,0,0,0
52017630,52,5211206,ESCOLA ESTADUAL JOAQUIM DA SILVA MOREIRA,2018,1,2,1,0,,01/01/2018,31/12/2018,1,0,0,0,0,0,0,1,0,0,0
52017656,52,5211206,CEPI JOSE PEDRO DE FARIA,2018,1,2,1,0,,02/01/2018,31/12/2018,1,0,0,0,0,0,1,1,0,0,0
52017664,52,5211206,COLEGIO ESTADUAL JOSE PEREIRA DE FARIA,2018,1,2,1,0,,02/01/2018,30/12/2018,1,1,0,0,0,0,0,1,0,0,0
52017699,52,5211206,ESCOLA ESTADUAL MILTON CAMILO DE FARIA,2018,1,2,1,0,,02/01/2018,31/12/2018,1,0,0,0,0,0,1,0,0,0,0
52017702,52,5211206,ESC MUN BETEL,2018,1,3,2,0,,22/01/2018,21/12/2018,1,0,0,0,0,1,1,1,0,0,0
52231364,52,5201405,COLEGIO PRINCIPADO,2018,3,4,1,,,,,,,,,,,,,,,
52003426,52,5208905,ESC MUL ARNULPHO DI RAMOS CAIADO,2018,3,3,2,,,,,,,,,,,,,,,
52019578,52,5218904,ESCOLA MUNICIPAL DOM JUVENAL RORIZ,2018,1,3,1,0,,22/01/2018,21/12/2018,1,0,0,0,1,1,1,0,0,0,0
52019608,52,5218904,COLEGIO ESTADUAL ANGELA PIMENTEL,2018,1,2,2,0,,22/01/2018,21/12/2018,1,0,0,0,0,0,1,1,1,0,0
52019624,52,5219357,COLEGIO ESTADUAL SANTA ISABEL,2018,1,2,1,0,,22/01/2018,21/12/2018,1,1,0,0,0,0,0,1,1,0,0
52019667,52,5219357,ESCOLA ESTADUAL JOAQUIM MARTINS CORREIA,2018,1,2,2,0,,22/01/2018,21/12/2018,1,0,0,0,0,0,1,1,0,0,0
52019675,52,5219357,ESCOLA ESTADUAL UMBELINA BRAZ GOMIDES,2018,1,2,1,0,,22/01/2018,22/12/2018,1,0,0,0,0,0,0,1,0,0,0
52019756,52,5219357,ESCOLA MUNICIPAL RAIMUNDO UBALDINO DE FREITAS,2018,1,3,1,0,,22/01/2018,21/12/2018,1,0,0,0,0,1,1,0,0,0,0
52019802,52,5220157,COLEGIO ESTADUAL MEIRA MATOS,2018,1,2,1,0,,01/01/2018,30/12/2018,1,1,0,0,0,0,0,1,1,0,0
52019837,52,5220157,ESC MUL LAVRINHAS DE SAO SEBASTIAO,2018,1,3,2,3,,22/01/2018,21/12/2018,1,0,0,0,0,1,1,1,0,0,0
52019896,52,5220157,ESCOLA MUNICIPAL PROFESSOR JOAQUIM ADELOZO DE SANTANA,2018,1,3,1,0,,22/01/2018,21/12/2018,1,0,0,0,0,1,1,0,0,0,0
52019926,52,5221700,COLEGIO ESTADUAL JOSE ALVES TOLEDO,2018,1,2,1,0,,02/01/2018,31/12/2018,1,1,0,0,0,0,0,0,1,0,0
52019942,52,5221700,ESCOLA ESTADUAL DIOGENES DE CASTRO RIBEIRO,2018,1,2,1,0,,02/01/2018,31/12/2018,1,0,0,0,0,0,1,1,0,0,0
52019950,52,5221700,CENTRO DE ENSINO EM PERIODO INTEGRAL EUCLIDES SERAFIM DE LIMA,2018,1,2,1,0,,22/01/2018,21/12/2018,1,0,0,0,0,0,0,1,0,0,0
52019977,52,5221700,ESCOLA ESTADUAL ORIGENES LEMES DA SILVA,2018,1,2,1,0,,22/01/2018,21/12/2018,1,0,0,0,0,0,1,1,0,0,0
52020002,52,5221700,COLEGIO ESTADUAL ZICO MONTEIRO,2018,1,2,1,0,,22/01/2018,21/12/2018,1,1,0,0,0,0,1,1,0,0,0
52101037,52,5218805,ESCOLA DE EDUCACAO INFANTIL PRIMEIROS PASSOS,2018,2,4,1,,,,,,,,,,,,,,,
52049310,52,5213053,ESCOLA MUNICIPAL MATO DENTRO,2018,2,3,2,,,,,,,,,,,,,,,
52018156,52,5211206,ESC EST DE CIBELE,2018,3,2,1,,,,,,,,,,,,,,,
52153207,52,5208707,COLEGIO OPCAO,2018,3,4,1,,,,,,,,,,,,,,,
52020967,52,5201108,COLEGIO ESTADUAL LEINY LOPES DE SOUZA,2018,1,2,1,0,,22/01/2018,21/12/2018,1,1,0,0,0,0,0,1,1,0,0
52020975,52,5201108,CENTRO DE ENSINO EM PERIODO INTEGRAL LIONS MELCHIOR DE ARAUJO,2018,1,2,1,0,,22/01/2018,21/12/2018,1,0,0,0,0,0,0,1,0,0,0
52020991,52,5201108,COLEGIO ESTADUAL MARIA APARECIDA ALVES,2018,1,2,1,0,,22/01/2018,21/12/2018,1,1,0,0,0,0,0,1,0,0,0
52021009,52,5201108,COLEGIO ESTADUAL OSVALDO FRANCISCO DA SILVA,2018,1,2,1,0,,22/01/2018,21/12/2018,1,1,0,0,0,0,0,1,1,0,0
52021017,52,5201108,ESCOLA PATRONATO MADRE MAZZARELLO,2018,1,4,1,0,4,22/01/2018,21/12/2018,1,0,0,0,0,0,0,1,0,0,0
52021025,52,5201108,COLEGIO ESTADUAL PLINIO JAIME,2018,1,2,1,0,,22/01/2018,21/12/2018,1,1,0,0,0,0,0,1,1,0,0
52021033,52,5201108,COLEGIO ESTADUAL PROFESSOR JOSE ABDALLA,2018,1,2,1,0,,22/01/2018,21/12/2018,1,1,0,0,0,0,0,1,1,0,0
52021041,52,5201108,COLEGIO ESTADUAL PROFESSOR SALVADOR SANTOS,2018,1,2,1,0,,22/01/2018,21/12/2018,1,1,0,0,0,0,0,1,0,0,0
52021068,52,5201108,COLEGIO ESTADUAL ROTARY DONANA,2018,1,2,1,0,,22/01/2018,21/12/2018,1,0,0,0,0,0,0,1,1,0,0
52021076,52,5201108,COLEGIO ESTADUAL VEREADOR LUIZ DE ALMEIDA,2018,1,2,1,0,,22/01/2018,21/12/2018,1,0,0,0,0,0,0,1,0,0,0
52021084,52,5201108,COLEGIO ESTADUAL VIOLETA PITALUGA,2018,1,2,1,0,,22/01/2018,21/12/2018,1,1,0,0,0,0,0,1,0,0,0
52021092,52,5201108,COLEGIO ESTADUAL WALDEMAR DE PAULA CAVALCANTI,2018,1,2,1,0,,22/01/2018,21/12/2018,1,1,0,0,0,0,0,1,1,0,0
52021106,52,5201108,COLEGIO ESTADUAL ZECA BATISTA,2018,1,2,1,0,,22/01/2018,21/12/2018,1,0,0,0,0,0,0,1,1,0,0
52021122,52,5201108,ESCOLA JARDIM DO EDEN,2018,1,4,1,0,1,22/01/2018,27/12/2018,1,0,0,0,1,1,1,0,0,0,0
52008550,52,5214101,ESC MUL JOSE A DE CARVALHO,2018,2,3,2,,,,,,,,,,,,,,,
52039447,52,5220454,ESCOLA MUNICIPAL SENADOR CANEDO,2018,1,3,1,0,,19/01/2018,19/12/2018,1,1,0,0,0,0,0,1,0,0,0
52039455,52,5220454,ESCOLA MUNICIPAL ALEXANDRE PEREIRA LIMA,2018,1,3,1,0,,19/01/2018,19/12/2018,1,1,0,0,0,0,1,0,0,0,0
52039463,52,5220454,ESCOLA MUNICIPAL DEOCLIDES ALVES DOS SANTOS,2018,1,3,1,0,,19/01/2018,19/12/2018,1,0,0,0,0,0,1,1,0,0,0
52039471,52,5220454,ESCOLA MUNICIPAL DOUTOR XAVIER DE ALMEIDA,2018,1,3,1,0,,19/01/2018,19/12/2018,1,0,0,0,0,1,1,1,0,0,0
52039480,52,5220454,ESCOLA MUNICIPAL IZABEL DE MATOS RIBEIRO,2018,1,3,1,0,,19/01/2018,19/12/2018,1,0,0,0,0,0,1,1,0,0,0
52039498,52,5220454,ESCOLA MUNICIPAL IRMA CATARINA JARDIM MIRANDA,2018,1,3,1,0,,19/01/2018,19/12/2018,1,1,0,0,0,0,1,1,0,0,0
52039501,52,5220454,ESCOLA MUNICIPAL WALTER FERREIRA DE CARVALHO,2018,1,3,1,0,,19/01/2018,19/12/2018,1,0,0,0,0,0,1,1,0,0,0
52039510,52,5220454,ESCOLA MUNICIPAL DE EDUCACAO INFANTIL BATISTA,2018,1,3,1,0,,19/01/2018,19/12/2018,1,0,0,0,0,1,0,0,0,0,0
52039528,52,5220454,ESCOLA MUNICIPAL JOSE BOTELHO PESSOA,2018,1,3,2,0,,19/01/2018,19/12/2018,1,0,0,0,0,1,1,1,0,0,0
52039544,52,5220454,ESCOLA MUNICIPAL ANTONIO EVARISTO DE MORAES,2018,1,3,1,0,,19/01/2018,19/12/2018,1,0,0,0,0,0,1,1,0,0,0
52039552,52,5220454,ESCOLA MUNICIPAL ARACY AMARAL,2018,1,3,1,0,,19/01/2018,19/12/2018,1,1,0,0,0,0,1,0,0,0,0
52039560,52,5220454,ESCOLA MUNICIPAL MARIA JOSE CANDIDO DE OLIVEIRA,2018,1,3,1,0,,19/01/2018,19/12/2018,1,0,0,0,0,0,1,1,0,0,0
52039579,52,5220454,ESCOLA MUNICIPAL ELIAS ROCHA RIBEIRO,2018,1,3,1,0,,19/01/2018,19/12/2018,1,0,0,0,0,1,1,0,0,0,0
52039587,52,5220454,ESCOLA MUNICIPAL PROFESSOR NILSON GOMES CAETANO,2018,1,3,1,0,,19/01/2018,19/12/2018,1,0,0,0,0,1,1,0,0,0,0
52044580,52,5205513,ESCOLA CORA CORALINA FONTE DO SABER,2018,2,4,1,,,,,,,,,,,,,,,
52092801,52,5219753,CMEI VOVO MARIA DIAS MACHADO,2018,2,3,1,,,,,,,,,,,,,,,
52040208,52,5200803,COLEGIO ESTADUAL ANTONIO CLARET CARDOSO,2018,1,2,1,0,,22/01/2018,21/12/2018,1,0,0,0,0,0,0,0,1,0,0
52040224,52,5200803,CRECHE ARMINDA FRANCISCA DE JESUS,2018,1,3,1,0,,22/01/2018,21/12/2018,1,0,0,0,1,1,0,0,0,0,0
52040240,52,5200803,ESCOLA ESTADUAL DR ANTONIO DI RAMOS CAIADO,2018,1,2,1,0,,02/01/2018,31/12/2018,1,1,0,0,0,0,1,1,1,0,0
52040259,52,5200803,CEPI MANOEL APRIGIO,2018,1,2,1,0,,22/01/2018,21/12/2018,1,0,0,0,0,0,0,1,0,0,0
52040267,52,5200803,CENTRO DE ENSINO EM PERIODO INTEGRAL PROFESSOR ALFREDO NASSER,2018,1,2,1,0,,22/01/2018,21/12/2018,1,0,0,0,0,0,0,1,0,0,0
52040291,52,5200803,ESC MUL DE 1º GRAU RAIMUNDO MENDES DA SILVA,2018,1,3,2,0,,26/01/2018,18/12/2018,1,0,0,0,0,0,1,0,0,0,0
52040305,52,5200803,ESCOLA MUNICIPAL DE 1º GRAU TIA NEIVA,2018,1,3,2,0,,26/01/2018,18/12/2018,1,0,0,0,0,1,1,0,0,0,0
52040364,52,5200803,ESCOLA MUNICIPAL PROFESSORA ODILIA JUSTA DA SILVA,2018,1,3,1,0,,22/01/2018,20/12/2018,1,0,0,0,0,0,1,1,0,0,0
52040410,52,5203962,COLEGIO ESTADUAL IRMA DULCE,2018,1,2,1,0,,02/01/2018,31/12/2018,1,1,0,0,0,0,0,1,1,0,0
52040437,52,5203962,ESCOLA MUNICIPAL PROFª ALAIDE PEREIRA BARBOSA BRITO,2018,1,3,1,0,,22/01/2018,21/12/2018,1,0,0,0,0,0,1,1,0,0,0
52040569,52,5203962,ESC MUL DA FAZENDA SANTA RITA,2018,1,3,2,0,,22/01/2018,21/12/2018,1,0,0,0,0,0,1,1,0,0,0
52040577,52,5206701,COLEGIO ESTADUAL JULIO MOREIRA DE MOURA,2018,1,2,1,0,,02/01/2018,31/12/2018,1,0,0,0,0,0,0,0,1,0,0
52040585,52,5206701,ESCOLA MUNICIPAL TANCREDO NEVES,2018,1,3,1,0,,22/01/2018,21/12/2018,1,0,0,0,0,0,1,0,0,0,0
52040607,52,5206701,ESCOLA ESTADUAL MANOEL LELIS,2018,1,2,1,0,,22/01/2018,21/12/2018,1,0,0,0,0,0,0,1,0,0,0
52098265,52,5220454,INSTITUTO DE ENSINO ARISTOTELES,2018,3,4,1,,,,,,,,,,,,,,,
52049078,52,5221858,ESCOLA URSINHOS CARINHOSOS,2018,2,4,1,,,,,,,,,,,,,,,
52086313,52,5200803,OBRAS SOCIAIS DE ALVORADA DO NORTE OSAN,2018,2,4,1,,,,,,,,,,,,,,,
52041921,52,5218300,COLEGIO ESTADUAL PROFESSORA JOSEFA BARBOSA VALENTE,2018,1,2,1,0,,02/01/2018,31/12/2018,1,1,0,0,0,0,1,1,1,0,0
52041930,52,5218300,ESCOLA MUNICIPAL MATIAS PINHEIRO LEMOS,2018,1,3,2,0,,22/01/2018,21/12/2018,1,0,0,0,0,1,1,1,0,0,0
52041948,52,5218300,ESCOLA MUNICIPAL AMBROSIO FERREIRA DA HORA,2018,1,3,2,0,,22/01/2018,21/12/2018,1,0,0,0,0,1,1,1,0,0,0
52042006,52,5218300,ESCOLA MUNICIPAL AURELIANO FERREIRA SILVA,2018,1,3,2,0,,22/01/2018,21/12/2018,1,0,0,0,0,1,1,0,0,0,0
52042022,52,5218300,ESCOLA MUNICIPAL CARLOS BISPO ALVES,2018,1,3,2,0,,22/01/2018,21/12/2018,1,0,0,0,0,1,1,1,0,0,0
52042081,52,5218300,ESCOLA MUNICIPAL DO POVOADO RODOVILANDIA,2018,1,3,2,0,,22/01/2018,22/12/2018,1,0,0,0,0,1,1,0,0,0,0
52042189,52,5218300,ESCOLA MUNICIPAL JOAQUIM GOMES DOS SANTOS,2018,1,3,2,0,,22/01/2018,22/12/2018,1,0,0,0,0,1,1,1,0,0,0
52042294,52,5218300,ESCOLA MUNICIPAL SEVERINO PEREIRA DOS SANTOS,2018,1,3,2,3,,22/01/2018,21/12/2018,1,0,0,0,0,1,1,0,0,0,0
52042308,52,5218300,ESCOLA RAVASCO,2018,1,4,1,0,4,22/01/2018,14/12/2018,1,0,0,0,1,1,1,0,0,0,0
52042324,52,5218300,ESCOLA MUNICIPAL PROFESSORA MARIA LEITE DE ALMEIDA NASCIMENTO,2018,1,3,1,0,,22/01/2018,21/12/2018,1,0,0,0,0,0,1,1,0,0,0
52042340,52,5218300,COLEGIO IMACULADO CORACAO DE MARIA,2018,1,4,1,0,1,22/01/2018,14/12/2018,1,0,0,0,1,1,1,1,1,0,0
52042359,52,5219803,COLEGIO ESTADUAL JOAO HONORATO,2018,1,2,1,0,,02/01/2018,31/12/2018,1,1,0,0,0,0,0,0,1,0,0
52042367,52,5219803,ESCOLA ESTADUAL JOAO REGES VALENTE,2018,1,2,1,0,,22/01/2018,21/12/2018,1,0,0,0,0,0,1,1,0,0,0
52042375,52,5219803,COLEGIO ESTADUAL MARIA REGIS VALENTE,2018,1,2,1,0,,02/01/2018,25/12/2018,1,1,0,0,0,0,0,1,0,0,0
52099717,52,5208707,ASSOCIACAO UNIFICADA PAULISTA DE ENSINO RENOVADO OBJETIVO - ASSUPERO CAMPUS I - FAZENDA BOTAFOGO,2018,2,4,1,,,,,,,,,,,,,,,
52042588,52,5219803,ESC MUL JATAI,2018,2,3,2,,,,,,,,,,,,,,,
52080749,52,5208707,COLEGIO PRE-UNIVERSITARIO,2018,3,4,1,,,,,,,,,,,,,,,
52044297,52,5205497,COLEGIO ESTADUAL OCIDENTAL,2018,1,2,1,0,,22/01/2018,21/12/2018,1,1,0,0,0,0,0,1,1,0,0
52044327,52,5205497,ESCOLA MUNICIPAL EDSON ANDRE DE AGUIAR,2018,1,3,1,0,,05/02/2018,21/12/2018,1,0,0,0,0,0,1,1,0,0,0
52044335,52,5205497,ESCOLA MUNICIPAL JOSE FERNANDES DA SILVA NETO,2018,1,3,1,0,,05/02/2018,21/12/2018,1,1,0,0,0,0,1,1,0,0,0
52044360,52,5205497,COLEGIO ESTADUAL JORGE AMADO,2018,1,2,1,0,,02/01/2018,31/12/2018,1,1,0,0,0,0,0,1,1,0,0
52044378,52,5205497,ESCOLA MUNICIPAL FREI AMILTON GOMES CURADO,2018,1,3,1,0,,05/02/2018,21/12/2018,1,1,0,0,0,1,1,0,0,0,0
52044386,52,5205497,ESC MUL ALEIXO PEREIRA BRAGA I,2018,1,3,1,3,,05/02/2018,21/12/2018,1,0,0,0,1,1,1,1,0,0,0
52044440,52,5205497,ESCOLA MUNICIPAL NOVA FRIBURGO,2018,1,3,1,0,,05/02/2018,21/12/2018,1,1,0,0,0,0,1,1,0,0,0
52044459,52,5205497,ESCOLA MUNICIPAL HELIO JONES BRANQUINHO,2018,1,3,1,0,,05/02/2018,22/12/2018,1,0,0,0,0,0,1,1,0,0,0
52044475,52,5205497,COLEGIO TIA IVONE,2018,1,4,1,0,1,23/01/2018,21/12/2018,1,0,0,0,1,1,1,1,1,0,0
52044491,52,5205497,ESCOLA BEM-ME-QUER,2018,1,4,1,0,1,05/02/2018,21/12/2018,1,0,0,0,1,1,1,1,0,0,0
52044572,52,5205513,COLEGIO ESTADUAL THIAGO VIDAL FERNANDES,2018,1,2,1,0,,22/01/2018,21/12/2018,1,1,0,0,0,0,0,0,1,0,0
52044602,52,5205513,ESCOLA ESTADUAL SENADOR JOSE ERMIRIO DE MORAES,2018,1,2,1,0,,22/01/2018,21/12/2018,1,0,0,0,0,0,0,1,0,0,0
52044629,52,5205513,ESC MUL ALTO BOA VISTA,2018,1,3,1,0,,22/01/2018,19/12/2018,1,0,0,0,0,0,1,1,0,0,0
52044815,52,5205513,ESC MUL NS SENHORA DE FATIMA,2018,1,3,1,0,,22/01/2018,19/12/2018,1,0,0,0,0,1,1,1,0,0,0
52012018,52,5221601,ESC MUL CORACAO DE MARIA,2018,3,3,2,,,,,,,,,,,,,,,
52065227,52,5205109,ESCOLA MUNICIPAL PEDRO NETTO PARANHOS,2018,1,3,1,0,,08/01/2018,20/12/2018,1,0,0,0,0,0,1,1,0,0,0
52065294,52,5205109,ESCOLA MUNICIPAL SANTA INES,2018,1,3,2,0,,15/01/2018,21/12/2018,1,0,0,0,0,1,1,1,0,0,0
52065324,52,5205109,ESCOLA MUNICIPAL DEPUTADO WISON DA PAIXAO,2018,1,3,1,0,,15/01/2018,21/12/2018,1,0,0,0,0,1,1,1,0,0,0
52065391,52,5205109,INSTITUTO DE EDUCACAO MATILDE MARGON VAZ,2018,1,2,1,0,,02/01/2018,21/12/2018,1,0,0,0,0,0,1,1,1,0,0
52065405,52,5205109,ESCOLA MUNICIPAL NILZA AYRES PIRES,2018,1,3,1,0,,15/01/2018,21/12/2018,1,0,0,0,0,0,1,0,0,0,0
52065413,52,5205109,CENTRO MUNICIPAL DE EDUCACAO INFANTIL PROFESSOR ANIBAL ROSA DO NASCIMENTO,2018,1,3,1,0,,15/01/2018,21/12/2018,1,0,0,0,1,1,0,0,0,0,0
52065421,52,5205109,ESCOLA MUNICIPAL PATOTINHA,2018,1,3,1,0,,15/01/2018,21/12/2018,1,0,0,0,0,0,1,0,0,0,0
52065430,52,5205109,ESCOLA MUNICIPAL FREI JOAO FRANCISCO,2018,1,3,1,0,,15/01/2018,21/12/2018,1,0,0,0,0,1,1,0,0,0,0
52065448,52,5205109,CENTRO MUNICIPAL DE EDUCACAO INFANTIL DONA MARIA ISABEL DE MENDONCA NETTO,2018,1,3,1,0,,15/01/2018,21/12/2018,1,0,0,0,1,1,0,0,0,0,0
52065456,52,5205109,COLEGIO ESTADUAL GILBERTO ARRUDA FALCAO,2018,1,2,2,0,,17/01/2018,21/12/2018,1,0,0,0,0,0,0,1,1,0,0
52065464,52,5205901,COLEGIO ESTADUAL SIMON BOLIVAR,2018,1,2,1,0,,22/01/2018,21/12/2018,1,1,0,0,0,0,0,1,1,0,0
52065472,52,5205901,ESC MUNICIPAL ASCENDINO CELESTINO DA SILVA,2018,1,3,1,0,,22/01/2018,20/12/2018,1,0,0,0,0,0,1,0,0,0,0
52065499,52,5205901,ESC MUN COUTO DE MAGALHAES,2018,1,3,1,0,,22/01/2018,20/12/2018,1,0,0,0,0,0,1,0,0,0,0
52065502,52,5205901,ESCOLA ESTADUAL OSORIO MARTINS CARDOSO,2018,1,2,1,0,,22/01/2018,21/12/2018,1,0,0,0,0,0,0,1,0,0,0
52019594,52,5218904,PRE ESC BRANCA DE NEVE,2018,3,3,1,,,,,,,,,,,,,,,
52013510,52,5205521,ESC MUL ISOLADA FAZ SUCUPIRA BRANCA,2018,3,3,2,,,,,,,,,,,,,,,
52087646,52,5221403,CENTRO SOCIAL PAI ETERNO,2018,2,4,1,,,,,,,,,,,,,,,
52052125,52,5204409,ESC MUL SAO JOSE,2018,3,3,2,,,,,,,,,,,,,,,
52067130,52,5204300,ESC MUL LAZARO GUILHERME PINTO,2018,1,3,2,0,,22/01/2018,21/12/2018,1,0,0,0,0,0,1,0,0,0,0
52067246,52,5204300,ESCOLA RECANTO EDUCACIONAL CHAPEUZINHO VERMELHO,2018,1,4,1,0,1,22/01/2018,21/12/2018,1,0,0,0,1,1,1,0,0,0,0
52067254,52,5204300,ESC MUL DEP JOSE DE ASSIS,2018,1,3,2,0,,21/01/2018,21/12/2018,1,0,0,0,0,0,1,0,0,0,0
52067289,52,5209150,COLEGIO ESTADUAL JOSE RODRIGUES MORENO,2018,1,2,1,0,,22/01/2018,21/12/2018,1,0,0,0,0,0,0,1,1,0,0
52067343,52,5212253,COLEGIO ESTADUAL DEPUTADO JOSE ALVES DE ASSIS,2018,1,2,1,0,,22/01/2018,21/12/2018,1,1,0,0,0,0,0,1,1,0,0
52067351,52,5210802,COLEGIO ESTADUAL PRESIDENTE CASTELO BRANCO,2018,1,2,1,0,,22/01/2018,21/12/2018,1,1,0,0,0,0,0,1,1,0,0
52067378,52,5210802,ESCOLA MUNICIPAL DONA BATISTA,2018,1,3,1,0,,22/01/2018,20/12/2018,1,0,0,0,0,1,1,0,0,0,0
52067386,52,5210802,ESCOLA MUNICIPAL ANHANGUERA,2018,1,3,1,0,,22/01/2018,20/12/2018,1,1,0,0,0,0,1,0,0,0,0
52067408,52,5210802,ESCOLA MUNICIPAL BELA VISTA,2018,1,3,2,0,,22/01/2018,20/12/2018,1,0,0,0,0,1,1,1,0,0,0
52067459,52,5211305,COLEGIO ESTADUAL COELHO NETO,2018,1,2,1,0,,02/01/2018,31/12/2018,1,1,0,0,0,0,0,1,1,0,0
52067491,52,5211305,ESC MUL PREFEITO IRONE JOSE DE ASSIS,2018,1,3,1,0,,22/01/2018,21/12/2018,1,0,0,0,0,0,1,0,0,0,0
52067530,52,5211305,ESCOLA MUNICIPAL JOSE ALVES DE ASSIS,2018,1,3,2,0,,22/01/2018,21/12/2018,1,0,0,0,0,0,1,1,0,0,0
52067661,52,5216304,COLEGIO ESTADUAL BELMIRO SOARES,2018,1,2,1,0,,01/01/2018,31/12/2018,1,1,0,0,0,0,0,0,1,0,0
52067670,52,5216304,EDUCANDARIO MUNICIPAL OSCAR BERNARDES,2018,1,3,1,0,,22/01/2018,21/12/2018,1,1,0,0,0,0,1,0,0,0,0
52088855,52,5214051,ESCOLA MUNICIPAL SAO JOAO DA MATA AZUL,2018,3,3,1,,,,,,,,,,,,,,,
52091341,52,5208707,ESCOLA ANJOS DO SABER LTDA,2018,3,4,1,,,,,,,,,,,,,,,
52088421,52,5203500,COLEGIO PARANAIBA,2018,2,4,1,,,,,,,,,,,,,,,
52068811,52,5208707,CENTRO DE ATENDIMENTO ESPECIALIZADO PETER PAN,2018,1,4,1,0,4,02/01/2018,31/12/2018,1,0,0,1,0,0,0,0,0,0,0
52068820,52,5208707,NUCLEO EDUCACIONAL PROFESSOR ANISIO TEIXEIRA,2018,1,4,1,0,4,22/01/2018,31/12/2018,1,0,0,1,0,0,0,0,0,0,0
52068854,52,5204300,ESCOLA MUNICIPAL OLIVIO GIROTTO,2018,1,3,1,0,,22/01/2018,21/12/2018,1,1,0,0,0,0,1,0,0,0,0
52068870,52,5208301,ESC MUL RAMIRO PINTO MAGALHAES,2018,1,3,2,1,,22/01/2018,21/12/2018,1,0,0,0,0,0,1,1,0,0,0
52068889,52,5204300,ESCOLA DE ENSINO ESPECIAL MIGUEL VICENTE DA SILVA,2018,1,4,1,0,1,02/01/2018,31/12/2018,0,0,0,0,0,0,0,0,0,0,0
52068897,52,5208707,ESC MUN MARCOS ANTONIO DIAS BATISTA,2018,1,3,1,0,,23/01/2018,23/12/2018,1,1,0,0,0,0,1,1,0,0,0
52068919,52,5208707,ESCOLA MUNICIPAL VEREADOR CARLOS EURICO DE CAMARGO ALVES,2018,1,3,1,0,,22/01/2018,21/12/2018,1,0,0,0,0,1,1,1,0,0,0
52068935,52,5205109,CENTRO DE EDUCACAO DE JOVENS E ADULTOS PROF ALZIRA DE SOUZA CAMPOS,2018,1,2,1,0,,17/01/2018,21/12/2018,0,1,0,0,0,0,0,0,0,0,0
52068943,52,5205406,CENTRO MUNICIPAL DE EDUCACAO INFANTIL MIRMA MARIA DE MOURA -CRECHE,2018,1,3,1,0,,22/01/2018,21/12/2018,1,0,0,0,1,0,0,0,0,0,0
52068951,52,5205901,ESCOLA MUNICIPAL COMECINHO DE VIDA,2018,1,3,1,0,,22/01/2018,20/12/2018,1,0,0,0,1,1,0,0,0,0,0
52068986,52,5208707,COLEGIO WR,2018,1,4,1,0,1,08/01/2018,18/12/2018,1,0,0,0,0,0,0,0,1,0,0
52068994,52,5208400,COLEGIO ESTADUAL DA POLICIA MILITAR DE GOIAS BENEDITA BRITO DE ANDRADE,2018,1,2,1,0,,22/01/2018,21/12/2018,1,0,0,0,0,0,0,1,1,0,0
52069001,52,5205901,ESC MUN GEANE MARCIA DOS SANTOS LOURENCO,2018,1,3,1,0,,01/02/2018,20/12/2018,1,0,0,0,0,1,0,0,0,0,0
52069010,52,5205901,CENTRO MULTIDISCIPLINAR DE ATENDIMENTO ESPECIALIZADO HILDA BRAGANCA QUINTA,2018,1,3,1,0,,22/01/2018,20/12/2018,0,0,0,0,0,0,0,0,0,0,0
52026990,52,5207600,ESC MUL RUI BARBOSA,2018,2,3,2,,,,,,,,,,,,,,,
52070026,52,5208707,CENTRO ORIENT REABILIT E ASSIS ENCEFALOPATA CORAE,2018,1,3,1,0,,22/01/2018,21/12/2018,1,1,0,1,0,0,0,0,0,0,0
52070050,52,5213103,ESCOLA MUNICIPAL REVERENDO EUDOXIO,2018,1,3,1,0,,22/01/2018,31/12/2018,1,0,0,0,0,1,1,0,0,0,0
52070069,52,5210208,CENTRO DE ATENDIMENTO EDUCACIONAL ESPECIALIZADO DE IPORA,2018,1,2,1,0,,02/01/2018,31/12/2018,0,0,0,0,0,0,0,0,0,0,0
52070077,52,5220686,ESCOLA MUNICIPAL JARDIM BRASIL,2018,1,3,1,0,,22/01/2018,21/12/2018,1,0,0,0,0,0,1,1,0,0,0
